{
  "schema_version": 1,
  "request_id": "service-credential-setup",
  "title": "Service credential setup",
  "needs": [
    {
      "type": "env",
      "name": "SERVICE_API_KEY",
      "required": true,
      "description": "Service API key"
    },
    {
      "type": "file",
      "name": "service_key.pem",
      "required": false,
      "target": "secrets/service_key.pem",
      "description": "Service private key PEM file",
      "max_bytes": 1048576
    }
  ],
  "forbidden_targets": [
    ".git",
    "node_modules"
  ],
  "write_policy": {
    "env_file": ".env.local",
    "mode": "merge_only",
    "no_overwrite": true,
    "backup": false,
    "max_file_size": 1048576
  }
}
